	sensor_id	source	comment	date_time	value
1364	114	WMO	Vaisala RS92/DigiCORA MW41 (Finland)                           		
1356	123	WMO	Vaisala RS41/DigiCORA MW41 (Finland)                           		
0	80	WMO	Vaisala RS92/Digicora III (Finland)               		
37	VNg 	SCH	  VNg Vaisala RS92 DigiCORA III auto corr, GPS wind 31313=48008^ <F=T400-406DL,P=Sc,T=Wc,U=2Ah,N=G>		
0	XXX 	SCH	  XXX Reject all obs with this station ID in this period^ misidentified or erroneous observations which should be rejected		
