	sensor_id	source	comment	date_time	value
1629	114	WMO	Vaisala RS92/DigiCORA MW41 (Finland)                           		
1656	141	WMO	Vaisala RS41 with pressure derived from GPS height/ DigiCORA MW41   (Finland)                  		
0	80	WMO	Vaisala RS92/Digicora III (Finland)               		
0	V8A 	SCH	  V8A Vaisala RS80 A-Humicap unspecified model {1981} WMO instr=37^ (assume W2=04 or 14, W3=37) <F=T403FL or 1680AL,P=Ac,T=CB,U=A>		
10	IGRA2	IGRA2	USING SONDE MODEL , I1 , UNKNOWN 	1993-01-01	3.0
